{
  "$schema": "http://json-schema.org/draft-07/schema#",
  "type": "object",
  "properties": {
    "$schema": {
      "type": "string"
    },
    "$comment": {
      "type": "string"
    },
    "name": {
      "type": "string",
      "pattern": "^[a-z0-9]+(-[a-z0-9]+)*$"
    },
    "baseUrl": {
      "type": "string"
    },
    "route": {
      "type": "string"
    },
    "viewports": {
      "minItems": 1,
      "type": "array",
      "items": {
        "type": "object",
        "properties": {
          "name": {
            "type": "string",
            "pattern": "^[a-z0-9]+(-[a-z0-9]+)*$"
          },
          "width": {
            "type": "integer",
            "minimum": 320,
            "maximum": 3840
          },
          "height": {
            "type": "integer",
            "minimum": 320,
            "maximum": 3840
          },
          "deviceScaleFactor": {
            "type": "number",
            "exclusiveMinimum": 0
          },
          "isMobile": {
            "type": "boolean"
          }
        },
        "required": [
          "name",
          "width",
          "height"
        ],
        "additionalProperties": false
      }
    },
    "scenarios": {
      "minItems": 1,
      "type": "array",
      "items": {
        "type": "object",
        "properties": {
          "id": {
            "type": "string",
            "pattern": "^[a-z0-9]+(-[a-z0-9]+)*$"
          },
          "label": {
            "type": "string",
            "minLength": 1
          },
          "note": {
            "type": "string",
            "minLength": 1
          },
          "request": {
            "type": "object",
            "properties": {
              "method": {
                "type": "string",
                "enum": [
                  "GET",
                  "POST",
                  "PUT",
                  "PATCH",
                  "DELETE",
                  "OPTIONS",
                  "HEAD"
                ]
              },
              "urlPattern": {
                "type": "string",
                "minLength": 1
              }
            },
            "required": [
              "method",
              "urlPattern"
            ],
            "additionalProperties": false
          },
          "response": {
            "oneOf": [
              {
                "type": "object",
                "properties": {
                  "mode": {
                    "type": "string",
                    "const": "delay"
                  },
                  "milliseconds": {
                    "type": "integer",
                    "minimum": 1,
                    "maximum": 60000
                  }
                },
                "required": [
                  "mode",
                  "milliseconds"
                ],
                "additionalProperties": false
              },
              {
                "type": "object",
                "properties": {
                  "mode": {
                    "type": "string",
                    "const": "fixture"
                  },
                  "path": {
                    "type": "string",
                    "minLength": 1
                  },
                  "status": {
                    "type": "integer",
                    "minimum": -9007199254740991,
                    "maximum": 9007199254740991
                  },
                  "headers": {
                    "type": "object",
                    "propertyNames": {
                      "type": "string"
                    },
                    "additionalProperties": {
                      "type": "string"
                    }
                  }
                },
                "required": [
                  "mode",
                  "path"
                ],
                "additionalProperties": false
              },
              {
                "type": "object",
                "properties": {
                  "mode": {
                    "type": "string",
                    "const": "inline"
                  },
                  "status": {
                    "type": "integer",
                    "minimum": -9007199254740991,
                    "maximum": 9007199254740991
                  },
                  "body": {},
                  "headers": {
                    "type": "object",
                    "propertyNames": {
                      "type": "string"
                    },
                    "additionalProperties": {
                      "type": "string"
                    }
                  }
                },
                "required": [
                  "mode",
                  "body"
                ],
                "additionalProperties": false
              },
              {
                "type": "object",
                "properties": {
                  "mode": {
                    "type": "string",
                    "const": "error"
                  },
                  "status": {
                    "type": "integer",
                    "minimum": 400,
                    "maximum": 599
                  },
                  "body": {},
                  "headers": {
                    "type": "object",
                    "propertyNames": {
                      "type": "string"
                    },
                    "additionalProperties": {
                      "type": "string"
                    }
                  }
                },
                "required": [
                  "mode",
                  "status"
                ],
                "additionalProperties": false
              },
              {
                "type": "object",
                "properties": {
                  "mode": {
                    "type": "string",
                    "const": "offline"
                  }
                },
                "required": [
                  "mode"
                ],
                "additionalProperties": false
              }
            ]
          },
          "expect": {
            "type": "object",
            "properties": {
              "visible": {
                "anyOf": [
                  {
                    "type": "string",
                    "minLength": 1
                  },
                  {
                    "minItems": 1,
                    "type": "array",
                    "items": {
                      "type": "string",
                      "minLength": 1
                    }
                  }
                ]
              },
              "timeoutMs": {
                "type": "integer",
                "exclusiveMinimum": 0,
                "maximum": 9007199254740991
              },
              "stableMs": {
                "type": "integer",
                "minimum": 0,
                "maximum": 9007199254740991
              }
            },
            "required": [
              "visible"
            ],
            "additionalProperties": false
          }
        },
        "required": [
          "id",
          "request",
          "response",
          "expect"
        ],
        "additionalProperties": false
      }
    }
  },
  "required": [
    "name",
    "baseUrl",
    "route",
    "scenarios"
  ],
  "additionalProperties": false
}
