{
  "$schema": "https://unpkg.com/@stateproof-dev/core@0.2.3/schema/v1.json",
  "name": "vue-account-settings",
  "baseUrl": "http://localhost:5174",
  "route": "/",
  "viewports": [
    { "name": "desktop", "width": 1440, "height": 1024, "deviceScaleFactor": 1, "isMobile": false },
    { "name": "mobile", "width": 390, "height": 844, "deviceScaleFactor": 2, "isMobile": true }
  ],
  "scenarios": [
    {
      "id": "vue-loading",
      "label": "Vue Loading Skeleton State",
      "request": { "method": "GET", "urlPattern": "**/api/account" },
      "response": { "mode": "delay", "milliseconds": 400 },
      "expect": { "visible": "[data-state='loading']" }
    },
    {
      "id": "vue-empty",
      "label": "Vue Empty State",
      "request": { "method": "GET", "urlPattern": "**/api/account" },
      "response": { "mode": "fixture", "path": "fixtures/account-empty.json" },
      "expect": { "visible": "[data-state='empty']" }
    },
    {
      "id": "vue-ready",
      "label": "Vue Ready State",
      "request": { "method": "GET", "urlPattern": "**/api/account" },
      "response": { "mode": "fixture", "path": "fixtures/account-ready.json" },
      "expect": { "visible": "[data-state='ready']" }
    },
    {
      "id": "vue-error",
      "label": "Vue Server Error State",
      "request": { "method": "GET", "urlPattern": "**/api/account" },
      "response": { "mode": "error", "status": 500 },
      "expect": { "visible": ["[data-state='error']", "[data-testid='retry']"] }
    },
    {
      "id": "vue-offline",
      "label": "Vue Offline State",
      "request": { "method": "GET", "urlPattern": "**/api/account" },
      "response": { "mode": "offline" },
      "expect": { "visible": ["[data-state='offline']", "[data-testid='retry']"] }
    }
  ]
}
